<?xml version="1.0" encoding="UTF-8"?>
<!-- XML Sample Message of message hierarchy                                          -->
<!-- Message:             ADC SAL Shipments Made Details v1.0 Rev. 3                  -->
<!-- Transaction:         AA - Audit Data Collection Rev. 235                         -->
<!-- Datamodel:           Audit Data Collection Datamodel, version HEAD Rev. 312      -->
<!-- XML tagset used:     AdcsML                                                      -->
<!-- Generated at:        23-01-2021 17:40:28                                         -->
<!-- Generated using:     EC-Design 2.5.0 (http://www.ec-design.nl)                   -->
<!-- Generated by:        Jan Vrijenhoek (Digitect)                                   -->
<!-- Organisation:        Digitect B.V. (Digitect)                                    -->
<!-- NOTE:    This sample message was generated automatically: manual modifications will be lost -->
<AdcSalShipmentsMadeDetails xsi:schemaLocation="http://schemas.iso.org/AdcsML/Messages/AdcSalShipmentsMadeDetails-v1 AdcSalShipmentsMadeDetails-v1.0.xsd"
		xmlns="http://schemas.iso.org/AdcsML/Messages/AdcSalShipmentsMadeDetails-v1"
		xmlns:xsi="http://www.w3.org/2001/XMLSchema-instance">
	<SalShpMadeDtls>
		<ShpId>SH1234</ShpId>
		<ShpDocLnId>1</ShpDocLnId>
		<ShpDocLnNr>1</ShpDocLnNr>
		<PrdctId>PRD001</PrdctId>
		<ShpngQt>100.0000</ShpngQt>
		<ShpngUomCd>KG</ShpngUomCd>
		<ShpngUnitPrice>80.00000000</ShpngUnitPrice>
		<ShpngLnTrAmt>8000.0000</ShpngLnTrAmt>
		<SalOrdLnId>1</SalOrdLnId>
		<SalOrdLnQt>100.0000</SalOrdLnQt>
		<OrdLnUomCd>KG</OrdLnUomCd>
		<OrdLnUnitPrice>80.00000000</OrdLnUnitPrice>
		<OrdLnTrAmt>8000.0000</OrdLnTrAmt>
		<BusSgX>BS001</BusSgX>
	</SalShpMadeDtls>
</AdcSalShipmentsMadeDetails>
